{
  "format": "extraction/1",
  "document": {
    "doc": "src-hd-csg-csf-gear-units",
    "sha256": "51ef1a16a6782b481fc97ddaec9739ea3df9ae2b1a0e057773497b3cc664a521",
    "pages": 6
  },
  "category": "reducer",
  "model": "CSF-20-50-2UH",
  "series": "CSF",
  "extractor": {
    "model": "claude-opus-5-5",
    "prompt_version": "extract/3",
    "response_id": "msg_011CfhYz46Femm56XRc64qn9"
  },
  "items": [
    {
      "target": "params/ratio",
      "value": {
        "value": 50.0,
        "source": {
          "doc": "src-hd-csg-csf-gear-units",
          "page": 9
        },
        "method": "extracted",
        "confidence": 0.85,
        "reviewed": false
      },
      "printed": {
        "text": "50",
        "unit": "",
        "label": "Ratio",
        "quote": "|  | 50 | 25 | 2.5 | 56 | 5.7 | 34 | 3.5 | 98 | 10 |  |  |  |  |  |  |"
      },
      "issues": [
        "叫法 'Ratio' 在表头，数值在该列"
      ]
    },
    {
      "target": "params/rated_torque_nm",
      "value": {
        "value": 25.0,
        "condition": "at 2000rpm",
        "source": {
          "doc": "src-hd-csg-csf-gear-units",
          "page": 9
        },
        "method": "extracted",
        "confidence": 0.85,
        "reviewed": false
      },
      "printed": {
        "text": "25",
        "unit": "Nm",
        "label": "Rated Torque at 2000rpm",
        "quote": "|  | 50 | 25 | 2.5 | 56 | 5.7 | 34 | 3.5 | 98 | 10 |  |  |  |  |  |  |"
      },
      "issues": [
        "叫法 'Rated Torque at 2000rpm' 在表头，数值在该列",
        "工况 'at 2000rpm' 不在同一行，取自本页其他位置（表头或脚注），须核对"
      ]
    },
    {
      "target": "params/repeated_peak_torque_nm",
      "value": {
        "value": 56.0,
        "source": {
          "doc": "src-hd-csg-csf-gear-units",
          "page": 9
        },
        "method": "extracted",
        "confidence": 0.85,
        "reviewed": false
      },
      "printed": {
        "text": "56",
        "unit": "Nm",
        "label": "Limit for Repeated Peak Torque",
        "quote": "|  | 50 | 25 | 2.5 | 56 | 5.7 | 34 | 3.5 | 98 | 10 |  |  |  |  |  |  |"
      },
      "issues": [
        "叫法 'Limit for Repeated Peak Torque' 在表头，数值在该列"
      ]
    },
    {
      "target": "params/momentary_max_torque_nm",
      "value": {
        "value": 98.0,
        "source": {
          "doc": "src-hd-csg-csf-gear-units",
          "page": 9
        },
        "method": "extracted",
        "confidence": 0.85,
        "reviewed": false
      },
      "printed": {
        "text": "98",
        "unit": "Nm",
        "label": "Limit for Momentary Peak Torque",
        "quote": "|  | 50 | 25 | 2.5 | 56 | 5.7 | 34 | 3.5 | 98 | 10 |  |  |  |  |  |  |"
      },
      "issues": [
        "叫法 'Limit for Momentary Peak Torque' 在表头，数值在该列"
      ]
    },
    {
      "target": "params/mass_kg",
      "value": {
        "value": 0.98,
        "source": {
          "doc": "src-hd-csg-csf-gear-units",
          "page": 11
        },
        "method": "extracted",
        "confidence": 0.75,
        "reviewed": false
      },
      "printed": {
        "text": "0.98",
        "unit": "kg",
        "label": "CSF Series",
        "quote": "|  | CSF Series | 0.52 | 0.68 | 0.98 | 1.5 | 3.2 | 5.0 | 7.0 | 8.9 | 14.6 | 20.9 |"
      }
    },
    {
      "target": "dims/outer_diameter_mm",
      "value": {
        "value": 93.0,
        "source": {
          "doc": "src-hd-csg-csf-gear-units",
          "page": 11
        },
        "method": "extracted",
        "confidence": 0.85,
        "reviewed": false
      },
      "printed": {
        "text": "93",
        "unit": "mm",
        "label": "φA",
        "quote": "| φA |  | 73 | 79 | 93 | 107 | 138 | 160 | 180 | 190 | 226 | 260 |"
      },
      "issues": [
        "单位 mm 不在同一行，取自本页其他位置"
      ]
    },
    {
      "target": "ports/input_bore/diameter_mm",
      "value": {
        "value": 12.0,
        "source": {
          "doc": "src-hd-csg-csf-gear-units",
          "page": 11
        },
        "method": "extracted",
        "confidence": 0.7,
        "reviewed": false
      },
      "printed": {
        "text": "12",
        "unit": "mm",
        "label": "φU H7",
        "quote": "φU H7 6 8 12 14 14 14 19 19 22 24"
      },
      "issues": [
        "单位 mm 不在同一行，取自本页其他位置"
      ]
    },
    {
      "target": "ports/housing_mount/pcd_mm",
      "value": {
        "value": 82.0,
        "source": {
          "doc": "src-hd-csg-csf-gear-units",
          "page": 11
        },
        "method": "extracted",
        "confidence": 0.6,
        "reviewed": false
      },
      "printed": {
        "text": "82",
        "unit": "mm",
        "label": "φb",
        "quote": "φb 65 71 82 96 125 144 164 174 206 236"
      },
      "issues": [
        "单位 mm 不在同一行，取自本页其他位置"
      ]
    },
    {
      "target": "ports/housing_mount/hole_diameter_mm",
      "value": {
        "value": 5.5,
        "source": {
          "doc": "src-hd-csg-csf-gear-units",
          "page": 11
        },
        "method": "extracted",
        "confidence": 0.6,
        "reviewed": false
      },
      "printed": {
        "text": "5.5",
        "unit": "mm",
        "label": "φd",
        "quote": "φd 4.5 4.5 5.5 5.5 6.6 9 9 9 11 14"
      },
      "issues": [
        "单位 mm 不在同一行，取自本页其他位置"
      ]
    },
    {
      "target": "ports/housing_mount/hole_count",
      "value": {
        "value": 6,
        "source": {
          "doc": "src-hd-csg-csf-gear-units",
          "page": 11
        },
        "method": "extracted",
        "confidence": 0.55,
        "reviewed": false
      },
      "printed": {
        "text": "6",
        "unit": "",
        "label": "CSF Series",
        "quote": "|  | CSF Series | 6 | 6 | 6 | 8 | 12 | 8 | 12 | 12 | 12 | 8 |"
      }
    },
    {
      "target": "ports/output_flange/pcd_mm",
      "value": {
        "value": 32.0,
        "source": {
          "doc": "src-hd-csg-csf-gear-units",
          "page": 11
        },
        "method": "extracted",
        "confidence": 0.55,
        "reviewed": false
      },
      "printed": {
        "text": "32",
        "unit": "mm",
        "label": "φX",
        "quote": "φX 23 27 32 42 55 68 82 84 100 110"
      },
      "issues": [
        "单位 mm 不在同一行，取自本页其他位置"
      ]
    },
    {
      "target": "ports/output_flange/hole_count",
      "value": {
        "value": 8,
        "source": {
          "doc": "src-hd-csg-csf-gear-units",
          "page": 11
        },
        "method": "extracted",
        "confidence": 0.55,
        "reviewed": false
      },
      "printed": {
        "text": "8",
        "unit": "",
        "label": "Y",
        "quote": "Y 6 6 8 8 8 8 8 8 8 8"
      }
    }
  ],
  "rejected": [
    {
      "reason": "数值不在目标型号所在的列",
      "target": "params/max_input_speed_rpm",
      "page": 9,
      "printed": {
        "text": "10000",
        "unit": "rpm",
        "label": "Maximum Input Speed (rpm)",
        "quote": "| 20 | 30 | 15 | 1.5 | 27 | 2.8 | 20 | 2.0 | 50 | 5.1 | 10000 | 6500 | 6500 | 3500 | 0.193 | 0.197 |"
      }
    },
    {
      "reason": "数值不在目标型号所在的列",
      "target": "params/max_input_speed_rpm",
      "page": 9,
      "printed": {
        "text": "6500",
        "unit": "rpm",
        "label": "Maximum Input Speed (rpm)",
        "quote": "| 20 | 30 | 15 | 1.5 | 27 | 2.8 | 20 | 2.0 | 50 | 5.1 | 10000 | 6500 | 6500 | 3500 | 0.193 | 0.197 |"
      }
    },
    {
      "reason": "数值不在目标型号所在的列",
      "target": "params/avg_input_speed_limit_rpm",
      "page": 9,
      "printed": {
        "text": "6500",
        "unit": "rpm",
        "label": "Limit for Average Input Speed (rpm)",
        "quote": "| 20 | 30 | 15 | 1.5 | 27 | 2.8 | 20 | 2.0 | 50 | 5.1 | 10000 | 6500 | 6500 | 3500 | 0.193 | 0.197 |"
      }
    },
    {
      "reason": "数值不在目标型号所在的列",
      "target": "params/avg_input_speed_limit_rpm",
      "page": 9,
      "printed": {
        "text": "3500",
        "unit": "rpm",
        "label": "Limit for Average Input Speed (rpm)",
        "quote": "| 20 | 30 | 15 | 1.5 | 27 | 2.8 | 20 | 2.0 | 50 | 5.1 | 10000 | 6500 | 6500 | 3500 | 0.193 | 0.197 |"
      }
    },
    {
      "reason": "数值不在目标型号所在的列",
      "target": "params/input_inertia_kgm2",
      "page": 9,
      "printed": {
        "text": "0.193",
        "unit": "×10−4kgm2",
        "label": "Moment of Inertia",
        "quote": "| 20 | 30 | 15 | 1.5 | 27 | 2.8 | 20 | 2.0 | 50 | 5.1 | 10000 | 6500 | 6500 | 3500 | 0.193 | 0.197 |"
      }
    },
    {
      "reason": "字段 ports/input_bore/fit 无单位，但印有单位 'mm'",
      "target": "ports/input_bore/fit",
      "page": 11,
      "printed": {
        "text": "12",
        "unit": "mm",
        "label": "φU H7",
        "quote": "φU H7 6 8 12 14 14 14 19 19 22 24"
      }
    },
    {
      "reason": "该行有 8 个数值，与 10 个型号列对不上",
      "target": "ports/input_bore/key_width_mm",
      "page": 11,
      "printed": {
        "text": "4",
        "unit": "mm",
        "label": "W Js9",
        "quote": "W Js9 - - 4 5 5 5 6 6 6 8"
      }
    },
    {
      "reason": "引用所在行中找不到与印出文字完全一致的数值",
      "target": "ports/output_flange/thread",
      "page": 11,
      "printed": {
        "text": "M6×9",
        "unit": "mm",
        "label": "Z",
        "quote": "Z M4×8 M5×10 M6×9 M8×12 M10×15 M10×15 M12×18 M14×21 M16×24 M16×24"
      }
    }
  ],
  "missing_key_fields": [
    "params/reducer_kind",
    "params/max_input_speed_rpm",
    "params/efficiency_ratio"
  ]
}
