{
  "format": "extraction/1",
  "document": {
    "doc": "src-hd-csg-csf-gear-units",
    "sha256": "51ef1a16a6782b481fc97ddaec9739ea3df9ae2b1a0e057773497b3cc664a521",
    "pages": 6
  },
  "category": "reducer",
  "model": "CSF-14-100-2UH",
  "series": "CSF",
  "extractor": {
    "model": "claude-sonnet-5-5",
    "prompt_version": "extract/3",
    "response_id": "msg_011CfhXkurwCg1hub1NBeM7f"
  },
  "items": [
    {
      "target": "params/ratio",
      "value": {
        "value": 100.0,
        "source": {
          "doc": "src-hd-csg-csf-gear-units",
          "page": 9
        },
        "method": "extracted",
        "confidence": 0.9,
        "reviewed": false
      },
      "printed": {
        "text": "100",
        "unit": "",
        "label": "Ratio",
        "quote": "|  | 100 | 7.8 | 0.80 | 28 | 2.9 | 11 | 1.1 | 54 | 5.5 |  |  |  |  |  |  |"
      },
      "issues": [
        "叫法 'Ratio' 在表头，数值在该列"
      ]
    },
    {
      "target": "params/rated_torque_nm",
      "value": {
        "value": 7.8,
        "condition": "Rated Torque at 2000rpm",
        "source": {
          "doc": "src-hd-csg-csf-gear-units",
          "page": 9
        },
        "method": "extracted",
        "confidence": 0.85,
        "reviewed": false
      },
      "printed": {
        "text": "7.8",
        "unit": "Nm",
        "label": "Rated Torque at 2000rpm",
        "quote": "|  | 100 | 7.8 | 0.80 | 28 | 2.9 | 11 | 1.1 | 54 | 5.5 |  |  |  |  |  |  |"
      },
      "issues": [
        "叫法 'Rated Torque at 2000rpm' 在表头，数值在该列",
        "工况 'Rated Torque at 2000rpm' 不在同一行，取自本页其他位置（表头或脚注），须核对"
      ]
    },
    {
      "target": "params/repeated_peak_torque_nm",
      "value": {
        "value": 28.0,
        "source": {
          "doc": "src-hd-csg-csf-gear-units",
          "page": 9
        },
        "method": "extracted",
        "confidence": 0.85,
        "reviewed": false
      },
      "printed": {
        "text": "28",
        "unit": "Nm",
        "label": "Limit for Repeated Peak Torque",
        "quote": "|  | 100 | 7.8 | 0.80 | 28 | 2.9 | 11 | 1.1 | 54 | 5.5 |  |  |  |  |  |  |"
      },
      "issues": [
        "叫法 'Limit for Repeated Peak Torque' 在表头，数值在该列"
      ]
    },
    {
      "target": "params/momentary_max_torque_nm",
      "value": {
        "value": 54.0,
        "source": {
          "doc": "src-hd-csg-csf-gear-units",
          "page": 9
        },
        "method": "extracted",
        "confidence": 0.85,
        "reviewed": false
      },
      "printed": {
        "text": "54",
        "unit": "Nm",
        "label": "Limit for Momentary Peak Torque",
        "quote": "|  | 100 | 7.8 | 0.80 | 28 | 2.9 | 11 | 1.1 | 54 | 5.5 |  |  |  |  |  |  |"
      },
      "issues": [
        "叫法 'Limit for Momentary Peak Torque' 在表头，数值在该列"
      ]
    },
    {
      "target": "dims/outer_diameter_mm",
      "value": {
        "value": 73.0,
        "source": {
          "doc": "src-hd-csg-csf-gear-units",
          "page": 10
        },
        "method": "extracted",
        "confidence": 0.85,
        "reviewed": false
      },
      "printed": {
        "text": "73",
        "unit": "mm",
        "label": "φA",
        "quote": "φA 73 79 93 107 138 160 180 190 226 260"
      },
      "issues": [
        "单位 mm 不在同一行，取自本页其他位置"
      ]
    },
    {
      "target": "ports/housing_mount/pcd_mm",
      "value": {
        "value": 65.0,
        "source": {
          "doc": "src-hd-csg-csf-gear-units",
          "page": 10
        },
        "method": "extracted",
        "confidence": 0.5,
        "reviewed": false
      },
      "printed": {
        "text": "65",
        "unit": "mm",
        "label": "φb",
        "quote": "φb 65 71 82 96 125 144 164 174 206 236"
      },
      "issues": [
        "单位 mm 不在同一行，取自本页其他位置"
      ]
    },
    {
      "target": "ports/housing_mount/hole_diameter_mm",
      "value": {
        "value": 4.5,
        "source": {
          "doc": "src-hd-csg-csf-gear-units",
          "page": 10
        },
        "method": "extracted",
        "confidence": 0.5,
        "reviewed": false
      },
      "printed": {
        "text": "4.5",
        "unit": "mm",
        "label": "φd",
        "quote": "φd 4.5 4.5 5.5 5.5 6.6 9 9 9 11 14"
      },
      "issues": [
        "单位 mm 不在同一行，取自本页其他位置"
      ]
    }
  ],
  "rejected": [
    {
      "reason": "引用所在行中找不到与印出文字完全一致的数值",
      "target": "params/reducer_kind",
      "page": 10,
      "printed": {
        "text": "CSF",
        "unit": "",
        "label": "Gear Unit CSG/CSF",
        "quote": "Gear Unit CSG/CSF"
      }
    },
    {
      "reason": "数值不在目标型号所在的列",
      "target": "params/max_input_speed_rpm",
      "page": 9,
      "printed": {
        "text": "14000",
        "unit": "rpm",
        "label": "Maximum Input Speed (rpm)",
        "quote": "| 14 | 30 | 4.0 | 0.41 | 9.0 | 0.92 | 6.8 | 0.69 | 17 | 1.7 | 14000 | 8500 | 6500 | 3500 | 0.033 | 0.034 |"
      }
    },
    {
      "reason": "数值不在目标型号所在的列",
      "target": "params/avg_input_speed_limit_rpm",
      "page": 9,
      "printed": {
        "text": "6500",
        "unit": "rpm",
        "label": "Limit for Average Input Speed (rpm)",
        "quote": "| 14 | 30 | 4.0 | 0.41 | 9.0 | 0.92 | 6.8 | 0.69 | 17 | 1.7 | 14000 | 8500 | 6500 | 3500 | 0.033 | 0.034 |"
      }
    },
    {
      "reason": "数值不在目标型号所在的列",
      "target": "params/input_inertia_kgm2",
      "page": 9,
      "printed": {
        "text": "0.033",
        "unit": "×10−4kgm2",
        "label": "Moment of Inertia I",
        "quote": "| 14 | 30 | 4.0 | 0.41 | 9.0 | 0.92 | 6.8 | 0.69 | 17 | 1.7 | 14000 | 8500 | 6500 | 3500 | 0.033 | 0.034 |"
      }
    },
    {
      "reason": "叫法不在引用所在的行中",
      "target": "params/mass_kg",
      "page": 10,
      "printed": {
        "text": "0.52",
        "unit": "kg",
        "label": "Mass (kg) CSF Series",
        "quote": "CSF Series 0.52 0.68 0.98 1.5 3.2 5.0 7.0 8.9 14.6 20.9"
      }
    },
    {
      "reason": "叫法不在引用所在的行中",
      "target": "ports/housing_mount/hole_count",
      "page": 10,
      "printed": {
        "text": "6",
        "unit": "",
        "label": "c CSF Series",
        "quote": "CSF Series 6 6 6 8 12 8 12 12 12 8"
      }
    },
    {
      "reason": "字段 ports/housing_mount/hole_kind 无单位，但印有单位 'mm'",
      "target": "ports/housing_mount/hole_kind",
      "page": 10,
      "printed": {
        "text": "4.5",
        "unit": "mm",
        "label": "φd",
        "quote": "φd 4.5 4.5 5.5 5.5 6.6 9 9 9 11 14"
      }
    },
    {
      "target": "vendor",
      "printed": {
        "text": "Harmonic Drive"
      },
      "reason": "vendor 在规格书中找不到"
    }
  ],
  "missing_key_fields": [
    "params/reducer_kind",
    "params/max_input_speed_rpm",
    "params/efficiency_ratio",
    "params/mass_kg"
  ]
}
