{
  "format": "extraction/1",
  "document": {
    "doc": "src-hd-csg-csf-gear-units",
    "sha256": "51ef1a16a6782b481fc97ddaec9739ea3df9ae2b1a0e057773497b3cc664a521",
    "pages": 6
  },
  "category": "reducer",
  "model": "CSF-17-100-2UH",
  "extractor": {
    "model": "claude-sonnet-5-5",
    "prompt_version": "extract/3",
    "response_id": "msg_011CfhXqaVjkh3Wt48ttZi5w"
  },
  "items": [
    {
      "target": "params/ratio",
      "value": {
        "value": 100.0,
        "source": {
          "doc": "src-hd-csg-csf-gear-units",
          "page": 9
        },
        "method": "extracted",
        "confidence": 0.85,
        "reviewed": false
      },
      "printed": {
        "text": "100",
        "unit": "",
        "label": "Ratio",
        "quote": "|  | 100 | 24 | 2.4 | 54 | 5.5 | 39 | 4.0 | 108 | 11 |  |  |  |  |  |  |"
      },
      "issues": [
        "叫法 'Ratio' 在表头，数值在该列"
      ]
    },
    {
      "target": "params/rated_torque_nm",
      "value": {
        "value": 24.0,
        "condition": "Rated Torque at 2000rpm",
        "source": {
          "doc": "src-hd-csg-csf-gear-units",
          "page": 9
        },
        "method": "extracted",
        "confidence": 0.8,
        "reviewed": false
      },
      "printed": {
        "text": "24",
        "unit": "Nm",
        "label": "Rated Torque at 2000rpm",
        "quote": "|  | 100 | 24 | 2.4 | 54 | 5.5 | 39 | 4.0 | 108 | 11 |  |  |  |  |  |  |"
      },
      "issues": [
        "叫法 'Rated Torque at 2000rpm' 在表头，数值在该列",
        "工况 'Rated Torque at 2000rpm' 不在同一行，取自本页其他位置（表头或脚注），须核对"
      ]
    },
    {
      "target": "params/repeated_peak_torque_nm",
      "value": {
        "value": 54.0,
        "source": {
          "doc": "src-hd-csg-csf-gear-units",
          "page": 9
        },
        "method": "extracted",
        "confidence": 0.8,
        "reviewed": false
      },
      "printed": {
        "text": "54",
        "unit": "Nm",
        "label": "Limit for Repeated Peak Torque",
        "quote": "|  | 100 | 24 | 2.4 | 54 | 5.5 | 39 | 4.0 | 108 | 11 |  |  |  |  |  |  |"
      },
      "issues": [
        "叫法 'Limit for Repeated Peak Torque' 在表头，数值在该列"
      ]
    },
    {
      "target": "params/momentary_max_torque_nm",
      "value": {
        "value": 108.0,
        "source": {
          "doc": "src-hd-csg-csf-gear-units",
          "page": 9
        },
        "method": "extracted",
        "confidence": 0.8,
        "reviewed": false
      },
      "printed": {
        "text": "108",
        "unit": "Nm",
        "label": "Limit for Momentary Peak Torque",
        "quote": "|  | 100 | 24 | 2.4 | 54 | 5.5 | 39 | 4.0 | 108 | 11 |  |  |  |  |  |  |"
      },
      "issues": [
        "叫法 'Limit for Momentary Peak Torque' 在表头，数值在该列"
      ]
    },
    {
      "target": "params/mass_kg",
      "value": {
        "value": 0.68,
        "source": {
          "doc": "src-hd-csg-csf-gear-units",
          "page": 11
        },
        "method": "extracted",
        "confidence": 0.85,
        "reviewed": false
      },
      "printed": {
        "text": "0.68",
        "unit": "kg",
        "label": "Mass (kg)",
        "quote": "| Mass (kg) | CSF Series | 0.52 | 0.68 | 0.98 | 1.5 | 3.2 | 5.0 | 7.0 | 8.9 | 14.6 | 20.9 |"
      }
    },
    {
      "target": "dims/outer_diameter_mm",
      "value": {
        "value": 79.0,
        "source": {
          "doc": "src-hd-csg-csf-gear-units",
          "page": 11
        },
        "method": "extracted",
        "confidence": 0.85,
        "reviewed": false
      },
      "printed": {
        "text": "79",
        "unit": "mm",
        "label": "φA",
        "quote": "| φA |  | 73 | 79 | 93 | 107 | 138 | 160 | 180 | 190 | 226 | 260 |"
      },
      "issues": [
        "单位 mm 不在同一行，取自本页其他位置"
      ]
    }
  ],
  "rejected": [
    {
      "reason": "引用所在行中找不到与印出文字完全一致的数值",
      "target": "params/reducer_kind",
      "page": 10,
      "printed": {
        "text": "CSF",
        "unit": "",
        "label": "Gear Unit CSG/CSF",
        "quote": "Gear Unit CSG/CSF"
      }
    },
    {
      "reason": "数值不在目标型号所在的列",
      "target": "params/input_inertia_kgm2",
      "page": 9,
      "printed": {
        "text": "0.079",
        "unit": "×10−4kgm2",
        "label": "Moment of Inertia",
        "quote": "| 17 | 30 | 8.8 | 0.90 | 16 | 1.6 | 12 | 1.2 | 30 | 3.1 | 10000 | 7300 | 6500 | 3500 | 0.079 | 0.081 |"
      }
    }
  ],
  "missing_key_fields": [
    "params/reducer_kind",
    "params/max_input_speed_rpm",
    "params/efficiency_ratio"
  ]
}
