{
  "format": "extraction/1",
  "document": {
    "doc": "src-yaskawa-sgd7s-ethercat-manual",
    "sha256": "723e4704cd939ecb805de328160b869a89909aff7050b33885c95a787c98fed6",
    "pages": 13
  },
  "category": "drive",
  "vendor": "Yaskawa",
  "model": "SGD7S-5R5A",
  "extractor": {
    "model": "claude-sonnet-5-5",
    "prompt_version": "extract/3",
    "response_id": "msg_011CfheEY4yziewu5ACNNCUo"
  },
  "items": [
    {
      "target": "ports/motor_out/rated_current_a",
      "value": {
        "value": 5.5,
        "source": {
          "doc": "src-yaskawa-sgd7s-ethercat-manual",
          "page": 64
        },
        "method": "extracted",
        "confidence": 0.85,
        "reviewed": false
      },
      "printed": {
        "text": "5.5",
        "unit": "Arms",
        "label": "Continuous Output Current [Arms]",
        "quote": "Continuous Output Current [Arms] 0.66 0.91 1.6 2.8 3.8 5.5 7.6 11.6"
      }
    },
    {
      "target": "ports/motor_out/peak_current_a",
      "value": {
        "value": 16.9,
        "source": {
          "doc": "src-yaskawa-sgd7s-ethercat-manual",
          "page": 63
        },
        "method": "extracted",
        "confidence": 0.85,
        "reviewed": false
      },
      "printed": {
        "text": "16.9",
        "unit": "Arms",
        "label": "Instantaneous Maximum Output Current [Arms]",
        "quote": "Instantaneous Maximum Output Current [Arms] 2.1 3.2 5.9 9.3 16.9 28"
      }
    }
  ],
  "rejected": [
    {
      "reason": "引用所在行中找不到与印出文字完全一致的数值",
      "target": "params/mass_kg",
      "page": 80,
      "printed": {
        "text": "1.6 kg",
        "unit": "kg",
        "label": "Approx. mass",
        "quote": "SGD7S-3R8A, -5R5A, -7R6A: 1.6 kg"
      }
    },
    {
      "reason": "该行有 0 个数值，与 11 个型号列对不上",
      "target": "ports/power_in/current_type",
      "page": 62,
      "printed": {
        "text": "Three-Phase, 200 VAC",
        "unit": "",
        "label": "Three-Phase, 200 VAC",
        "quote": "Three-Phase, 200 VAC"
      }
    },
    {
      "reason": "引用所在行中找不到与印出文字完全一致的数值",
      "target": "ports/power_in/phases",
      "page": 62,
      "printed": {
        "text": "Three-Phase",
        "unit": "",
        "label": "Three-Phase",
        "quote": "Three-Phase, 200 VAC"
      }
    },
    {
      "reason": "引用所在行中找不到与印出文字完全一致的数值",
      "target": "ports/power_in/voltage_v",
      "page": 62,
      "printed": {
        "text": "200 VAC to 240 VAC",
        "unit": "VAC",
        "label": "Power Supply",
        "quote": "Power Supply 200 VAC to 240 VAC, 50 Hz/60 Hz"
      }
    },
    {
      "reason": "工况 'Three-Phase, 200 VAC, main circuit' 在第 62 页找不到",
      "target": "ports/power_in/rated_current_a",
      "page": 62,
      "printed": {
        "text": "4.1",
        "unit": "Arms",
        "label": "Input Current [Arms]*",
        "quote": "|  | Input Current [Arms]* |  | 0.4 | 0.8 | 1.3 | 2.5 | 3.0 | 4.1 | 5.7 | 7.3 | 10 | 15 |  |"
      }
    },
    {
      "reason": "引用所在行中找不到与印出文字完全一致的数值",
      "target": "ports/bus/protocol",
      "page": 69,
      "printed": {
        "text": "IEC 61158 Type 12, IEC 61800-7 CiA402 Drive Profile",
        "unit": "",
        "label": "Applicable Communications Standards",
        "quote": "IEC 61158 Type 12, IEC 61800-7 CiA402 Drive Profile"
      }
    },
    {
      "reason": "原文引用在第 69 页的任何一行中都找不到",
      "target": "ports/bus/connector",
      "page": 69,
      "printed": {
        "text": "CN6A (RJ45)",
        "unit": "",
        "label": "Communications Connectors",
        "quote": "Connectors CN6A (RJ45): ETHERCAT IN (EtherCAT signal input connector)"
      }
    },
    {
      "reason": "工况 'Σ-7-series mounting hole dimensions' 在第 90 页找不到",
      "target": "ports/mount/thread",
      "page": 90,
      "printed": {
        "text": "M4",
        "unit": "",
        "label": "Screw Size",
        "quote": "|  | 3R8A, 5R5A, 7R6A, 2R8F | 168 | 5 | 160 ±0.5 | 70 | 6 | 58 ±0.5 | 64 | − | M4 |  |"
      }
    }
  ],
  "missing_key_fields": []
}
