{
  "format": "extraction/1",
  "document": {
    "doc": "src-yaskawa-sgd7s-ethercat-manual",
    "sha256": "723e4704cd939ecb805de328160b869a89909aff7050b33885c95a787c98fed6",
    "pages": 12
  },
  "category": "drive",
  "model": "SGD7S-R70A",
  "extractor": {
    "model": "claude-sonnet-5-5",
    "prompt_version": "extract/3",
    "response_id": "msg_011CfhYUmT5exMiyzvbJuSYz"
  },
  "items": [
    {
      "target": "ports/motor_out/rated_current_a",
      "value": {
        "value": 0.66,
        "source": {
          "doc": "src-yaskawa-sgd7s-ethercat-manual",
          "page": 63
        },
        "method": "extracted",
        "confidence": 0.85,
        "reviewed": false
      },
      "printed": {
        "text": "0.66",
        "unit": "Arms",
        "label": "Continuous Output Current [Arms]",
        "quote": "Continuous Output Current [Arms] 0.66 0.91 1.6 2.8 5.5 11.6"
      }
    },
    {
      "target": "ports/motor_out/peak_current_a",
      "value": {
        "value": 2.1,
        "source": {
          "doc": "src-yaskawa-sgd7s-ethercat-manual",
          "page": 63
        },
        "method": "extracted",
        "confidence": 0.85,
        "reviewed": false
      },
      "printed": {
        "text": "2.1",
        "unit": "Arms",
        "label": "Instantaneous Maximum Output Current [Arms]",
        "quote": "Instantaneous Maximum Output Current [Arms] 2.1 3.2 5.9 9.3 16.9 28"
      }
    }
  ],
  "rejected": [
    {
      "reason": "工况 'Three-Phase, 200 VAC, Main Circuit' 在第 62 页找不到",
      "target": "ports/power_in/current_type",
      "page": 62,
      "printed": {
        "text": "200 VAC to 240 VAC, 50 Hz/60 Hz",
        "unit": "",
        "label": "Power Supply",
        "quote": "Power Supply 200 VAC to 240 VAC, 50 Hz/60 Hz"
      }
    },
    {
      "reason": "引用所在行中找不到与印出文字完全一致的数值",
      "target": "ports/power_in/voltage_v",
      "page": 62,
      "printed": {
        "text": "200 VAC to 240 VAC",
        "unit": "VAC",
        "label": "Power Supply",
        "quote": "Power Supply 200 VAC to 240 VAC, 50 Hz/60 Hz"
      }
    },
    {
      "reason": "该行有 0 个数值，与 11 个型号列对不上",
      "target": "ports/power_in/phases",
      "page": 62,
      "printed": {
        "text": "Three-Phase, 200 VAC",
        "unit": "",
        "label": "Three-Phase, 200 VAC",
        "quote": "Three-Phase, 200 VAC"
      }
    },
    {
      "reason": "工况 'Three-Phase 200 VAC, Main Circuit' 在第 62 页找不到",
      "target": "ports/power_in/rated_current_a",
      "page": 62,
      "printed": {
        "text": "0.4",
        "unit": "Arms",
        "label": "Input Current [Arms]*",
        "quote": "|  | Input Current [Arms]* |  | 0.4 | 0.8 | 1.3 | 2.5 | 3.0 | 4.1 | 5.7 | 7.3 | 10 | 15 |  |"
      }
    },
    {
      "reason": "引用所在行中找不到与印出文字完全一致的数值",
      "target": "ports/bus/protocol",
      "page": 69,
      "printed": {
        "text": "IEC 61158 Type 12, IEC 61800-7 CiA402 Drive Profile",
        "unit": "",
        "label": "Applicable Communications Standards",
        "quote": "IEC 61158 Type 12, IEC 61800-7 CiA402 Drive Profile"
      }
    },
    {
      "reason": "引用所在行中找不到与印出文字完全一致的数值",
      "target": "ports/bus/profile",
      "page": 69,
      "printed": {
        "text": "IEC 61158 Type 12, IEC 61800-7 CiA402 Drive Profile",
        "unit": "",
        "label": "CiA402 Drive Profile",
        "quote": "IEC 61158 Type 12, IEC 61800-7 CiA402 Drive Profile"
      }
    },
    {
      "target": "vendor",
      "printed": {
        "text": "Yaskawa"
      },
      "reason": "vendor 在规格书中找不到"
    }
  ],
  "missing_key_fields": []
}
